{
  "schemaVersion": "dascowork-primary-runtime-inputs.v1",
  "target": "darwin-x64",
  "sourceLockSha256": "5fd22c6ac0a33ad47d98b5cd8a748afbd33dd1c9e3cc93df9bba21a18bd0601d",
  "toolchainsLockSha256": "f3545e5994eb38c0bf652ff6e6076e459793a9082b28b18cc243f31d884813b6",
  "builder": {
    "name": "@dascowork/primary-runtime-materializer",
    "version": "1.4.0",
    "runner": "macos-15-intel",
    "identity": "github-hosted:macos-15-intel",
    "observedImage": "github-hosted:macos-15-intel:20260824.0482.1",
    "observedImageSha256": "de0e36560092f16dd09a9d0c3bd46156a5d1d01df5b0211549c16f4a66c54558",
    "tools": [
      {
        "command": "tar",
        "versionSha256": "f761f3518d37db8e9f1b77644bcbbe85f6b03bb87684b6b16acc8b5b46fbe766"
      },
      {
        "command": "hdiutil",
        "versionSha256": "f7f096b1726e1fe7d260b2e942b5a964a5ff8c783370ebaabcda19520226031a"
      },
      {
        "command": "xattr",
        "versionSha256": "5c4088a1385ea3af7acb3ea2df326596831f4552435dfff9b473a6e56e36aca7"
      },
      {
        "command": "cmake",
        "versionSha256": "25ccfac39d8920de7c484efdef450aebbe777449e219398e3c76851eecdd721c"
      },
      {
        "command": "ninja",
        "versionSha256": "87729f1910e8eb02719463db46083e0f1a4c3cbade23b357806338b25df16a6a"
      },
      {
        "command": "clang",
        "versionSha256": "6d366eee5ac6d909249830892c8846df457f835554e1481da864b4d455e951d5"
      }
    ]
  },
  "artifacts": [
    {
      "name": "libpng",
      "version": "1.6.52",
      "sha256": "36bd726228ec93a3b6c22fdb49e94a67b16f2fe9b39b78b7cb65772966661ccc",
      "license": "Libpng-2.0",
      "kind": "component:native"
    },
    {
      "name": "officecli-darwin-x64",
      "version": "1.0.152",
      "sha256": "5071abef56c1d4a4d60e28ed12bc66183d8dc6a9783529c3f1a9cf6bdfe6c2dd",
      "license": "Apache-2.0",
      "kind": "component:native"
    },
    {
      "name": "freetype",
      "version": "2.13.3",
      "sha256": "68ce87bb59ea209eb7350f41a94a27519ce16b37011b475a1e62d4abee154b66",
      "license": "FTL OR GPL-2.0-only",
      "kind": "component:native"
    },
    {
      "name": "poppler",
      "version": "26.09.0",
      "sha256": "8059eadb6805340768f138c465b57f8164c92b4a0773c37ef031ea6c0d987b2e",
      "license": "GPL-2.0-or-later",
      "kind": "component:native"
    },
    {
      "name": "noto-sans-cjk-sc",
      "version": "2.004",
      "sha256": "a927e56f53bd6c3b920bc139c0b94aa36c7d9ad0cf009b159437a1a003581140",
      "license": "OFL-1.1",
      "kind": "component:fonts"
    },
    {
      "name": "zlib",
      "version": "1.3.1",
      "sha256": "d9e270d46252734aa49770fbc544125391617956266f220bd63216c834f3a522",
      "license": "Zlib",
      "kind": "component:native"
    }
  ],
  "patches": [],
  "files": [
    {
      "path": "dependencies/native/freetype/include/freetype2/freetype/config/ftconfig.h",
      "mode": "100644",
      "sha256": "907749b955e0209b26b22aef9cf8694742017f6cdccd8ac332867b54ec2fc5fc"
    },
    {
      "path": "dependencies/native/freetype/include/freetype2/freetype/config/ftheader.h",
      "mode": "100644",
      "sha256": "0e731fa6a148f64ff15274423553ec187a1aef297d130c430ff07951554ef8a1"
    },
    {
      "path": "dependencies/native/freetype/include/freetype2/freetype/config/ftmodule.h",
      "mode": "100644",
      "sha256": "61c76e01106e7b7c80f39f8d6fd479b5323b54d757c9a2cb66d07064ef616649"
    },
    {
      "path": "dependencies/native/freetype/include/freetype2/freetype/config/ftoption.h",
      "mode": "100644",
      "sha256": "6a14a03776c822b4c528cb05de40e3fea2b87649984a4fb3a852bee87c0f63d9"
    },
    {
      "path": "dependencies/native/freetype/include/freetype2/freetype/config/ftstdlib.h",
      "mode": "100644",
      "sha256": "fafd7eb672702cb2dc20b7e7e19540d251a3d978745821bc0632ba807c8b6f46"
    },
    {
      "path": "dependencies/native/freetype/include/freetype2/freetype/config/integer-types.h",
      "mode": "100644",
      "sha256": "8cc533596bff2f044823853f5d394bc697d6572c9c664f6beaaa67e066bfe162"
    },
    {
      "path": "dependencies/native/freetype/include/freetype2/freetype/config/mac-support.h",
      "mode": "100644",
      "sha256": "557701edb1bf2c98e38c7331e7522b4c35d390cb9899461d2eea4a74ab460196"
    },
    {
      "path": "dependencies/native/freetype/include/freetype2/freetype/config/public-macros.h",
      "mode": "100644",
      "sha256": "eb069473a8fbd2342388fbaade8f1159428b3b7a95a070a16eb84c16cd26316c"
    },
    {
      "path": "dependencies/native/freetype/include/freetype2/freetype/freetype.h",
      "mode": "100644",
      "sha256": "b8d8b9e32b2956cce3a9c5d9b8d18041fb7451acb747805c20b62bf1b4804cdb"
    },
    {
      "path": "dependencies/native/freetype/include/freetype2/freetype/ftadvanc.h",
      "mode": "100644",
      "sha256": "f8a70e19eac6782a5e6f5199c3cf6922c3cde46a10ffb71fa85f93cd0cf8f6db"
    },
    {
      "path": "dependencies/native/freetype/include/freetype2/freetype/ftbbox.h",
      "mode": "100644",
      "sha256": "3d04ed642305afb3b2287ef0aba26577748acd581b6bf5df263770af4a3fedc6"
    },
    {
      "path": "dependencies/native/freetype/include/freetype2/freetype/ftbdf.h",
      "mode": "100644",
      "sha256": "84cdb9ad4caadaee343fe2f3591dcea62aeaa5bf21d5c5595214f38906c58310"
    },
    {
      "path": "dependencies/native/freetype/include/freetype2/freetype/ftbitmap.h",
      "mode": "100644",
      "sha256": "aba4a5afc772eb002e2fc98ae41dc86b7cbd634a2ccc7c5fcc31861846fa9fc5"
    },
    {
      "path": "dependencies/native/freetype/include/freetype2/freetype/ftbzip2.h",
      "mode": "100644",
      "sha256": "76c9e1a31ebe293af5989d18c742a33a1869b4cc1ef4dfc3a535fa10a09862cb"
    },
    {
      "path": "dependencies/native/freetype/include/freetype2/freetype/ftcache.h",
      "mode": "100644",
      "sha256": "ef9835cc69d1bb496605632817d571ecd00691fe986f5e08c552cdf8b56aabd6"
    },
    {
      "path": "dependencies/native/freetype/include/freetype2/freetype/ftchapters.h",
      "mode": "100644",
      "sha256": "c7d1c2ca13903fb6d0b3b37850344d805280856fb87c7597087ce2352573f752"
    },
    {
      "path": "dependencies/native/freetype/include/freetype2/freetype/ftcid.h",
      "mode": "100644",
      "sha256": "e5c70ccb41b3c50a9958eee55e10407b2190a4afa1640e8c08c251fe1c0f826a"
    },
    {
      "path": "dependencies/native/freetype/include/freetype2/freetype/ftcolor.h",
      "mode": "100644",
      "sha256": "ba543bb2f608e8e1d6c97e7cd3da0a9e7ac23af4586bc3db75ca24750ef94692"
    },
    {
      "path": "dependencies/native/freetype/include/freetype2/freetype/ftdriver.h",
      "mode": "100644",
      "sha256": "cf44747d59263798e482ae5b932732b7729b75744014849d1001c4bdd4446c11"
    },
    {
      "path": "dependencies/native/freetype/include/freetype2/freetype/fterrdef.h",
      "mode": "100644",
      "sha256": "b83e0829b58949afede67e2f8a2fc9b3cafad9e3b4fd11d7ee9c87bd92c6d6c0"
    },
    {
      "path": "dependencies/native/freetype/include/freetype2/freetype/fterrors.h",
      "mode": "100644",
      "sha256": "12e955a5cb109519ee4421a03d4a5c324986c8fa01296eaa56e144e2851927ec"
    },
    {
      "path": "dependencies/native/freetype/include/freetype2/freetype/ftfntfmt.h",
      "mode": "100644",
      "sha256": "70b57ca7ae6f18403c0bfd2e58ab5e566f42026f25809f7b16fe147e686d4625"
    },
    {
      "path": "dependencies/native/freetype/include/freetype2/freetype/ftgasp.h",
      "mode": "100644",
      "sha256": "83af54183584ad16843b3d0d54eb63e4776bd0cce2d4b8a68cd80b718d740b76"
    },
    {
      "path": "dependencies/native/freetype/include/freetype2/freetype/ftglyph.h",
      "mode": "100644",
      "sha256": "7b13bb1d8501458cd35b7a279c01c1ee89417ceefa516b8eb416d175fe8df9e6"
    },
    {
      "path": "dependencies/native/freetype/include/freetype2/freetype/ftgxval.h",
      "mode": "100644",
      "sha256": "ff9b9e6d8bac9008c3f3404db8eefbe086632ba3dcbd925e59934d87e771535c"
    },
    {
      "path": "dependencies/native/freetype/include/freetype2/freetype/ftgzip.h",
      "mode": "100644",
      "sha256": "56d7d349af43263a2507cbb7260669f8acd4db2dce08f7a7e7df9d701144de12"
    },
    {
      "path": "dependencies/native/freetype/include/freetype2/freetype/ftimage.h",
      "mode": "100644",
      "sha256": "6245bd165b8a2f5ea6615be6cfc51aa8327ecbea45f42cbce2b8fb625f84574a"
    },
    {
      "path": "dependencies/native/freetype/include/freetype2/freetype/ftincrem.h",
      "mode": "100644",
      "sha256": "b5bbf21a6d94d500dd334a99eaf27364fd701d696d8891fd1df013aa0a223b3b"
    },
    {
      "path": "dependencies/native/freetype/include/freetype2/freetype/ftlcdfil.h",
      "mode": "100644",
      "sha256": "96f6c9bac843c30f3d329760e8f5ea061d958ba302682d69a50d953c193f73bf"
    },
    {
      "path": "dependencies/native/freetype/include/freetype2/freetype/ftlist.h",
      "mode": "100644",
      "sha256": "47d82894f2c3e187b8659d1966fdba44348c1739a88751a5a42a5a97c7a209ce"
    },
    {
      "path": "dependencies/native/freetype/include/freetype2/freetype/ftlogging.h",
      "mode": "100644",
      "sha256": "adfcb1f6c6ff73b6bfed707c74d7c22e2aea7528de728588eb051b4ecb18f279"
    },
    {
      "path": "dependencies/native/freetype/include/freetype2/freetype/ftlzw.h",
      "mode": "100644",
      "sha256": "2d5bf1d9075275776e9be7becd793ac079f52982f7db70ec87ea764f637a4fcd"
    },
    {
      "path": "dependencies/native/freetype/include/freetype2/freetype/ftmac.h",
      "mode": "100644",
      "sha256": "d39f3c3c117dea90597fc51d6bf51c6e6b3708ac60a5fb52e311d90b04da542b"
    },
    {
      "path": "dependencies/native/freetype/include/freetype2/freetype/ftmm.h",
      "mode": "100644",
      "sha256": "173d1d20553eec5163d9bb18a78acb3a0059e2879618b9edc5632a3e7a6252a3"
    },
    {
      "path": "dependencies/native/freetype/include/freetype2/freetype/ftmodapi.h",
      "mode": "100644",
      "sha256": "3b05e210b4705017d68e00def6820749fd0fca2f185ab2bb5df06d71928e29eb"
    },
    {